{
  "id": 29,
  "operationDate": "2022-06-23T18:47:30.868+03:00",
  "emiasId": 18027361,
  "uklErp": "30416317",
  "studentId": "e5c9b68a-a3c7-6688-e043-a2997e0ac8c8",
  "studentPersonId": "7445b4ed-f762-49c1-a58d-2edd164c95e3",
  "patientStudentLinkStatus": "Y",
  "patientType": "I",
  "patientRecStatus": "Y",
  "entityName": "schoolAttachment",
  "entityData": [
    {
      "attributes": [
        {
          "name": "attachId",
          "type": "integer",
          "value": {
            "value": "124922913"
          }
        },
        {
          "name": "attachType",
          "type": "dictionary",
          "value": {
            "id": 128619874,
            "code": "9",
            "value": "школьное"
          }
        },
        {
          "name": "attachForm",
          "type": "dictionary",
          "value": {
            "id": 128620020,
            "code": "60",
            "value": "Прикрепление к классу"
          }
        },
        {
          "name": "organizationId",
          "type": "integer",
          "value": {
            "value": "200001512243"
          }
        },
        {
          "name": "areaId",
          "type": "integer",
          "value": {
            "value": "17411929190"
          }
        },
        {
          "name": "attachStartDate",
          "type": "date",
          "value": {
            "value": "2021-08-23"
          }
        },
        {
          "name": "attachEndDate",
          "type": "date",
          "value": {}
        },
        {
          "name": "isActual",
          "type": "long",
          "value": {
            "value": "true"
          }
        },
        {
          "name": "classUid",
          "type": "guid",
          "value": {
            "value": "43fdbd33-0766-40a2-a84c-d0b4492499ab"
          }
        },
        {
          "name": "academicYear",
          "type": "dictionary",
          "value": {
            "id": 22,
            "value": "2021/2022"
          }
        },
        {
          "name": "educationForm",
          "type": "dictionary",
          "value": {
            "id": 1,
            "value": "Очная"
          }
        },
        {
          "name": "deductionReason",
          "type": "dictionary",
          "value": {}
        },
        {
          "name": "trainingBeginDate",
          "type": "date",
          "value": {
            "value": "2021-08-23T00:00"
          }
        },
        {
          "name": "trainingEndDate",
          "type": "date",
          "value": {
            "value": "2099-01-01T00:00"
          }
        }
      ]
    }
  ]
}